case_id,patient_id,ward,report_date,shift,nursing_note_free_text
CASE-255,PAT-206205,Geriatrics,2026-02-14,Night shift,"Nachtdienst: Mild dyspnea on exertion, Mobilization possible only with two staff members, Pain score 5/10 in surgical area. Interventions: Family discussion conducted, Vital signs checked, Physician informed about condition. Evaluation: Therapy adjustment ordered by physician."
CASE-255,PAT-206205,Geriatrics,2026-02-15,Early shift,"Frühdienst: Called staff multiple times during the night, Wound reddened, dressing changed, Patient awake and oriented. Interventions: Family discussion conducted, Blood glucose monitored, Fluid balance documented, PRN medication given after consultation. Evaluation: Therapy adjustment ordered by physician."
CASE-255,PAT-206205,Geriatrics,2026-02-16,Late shift,"Spätdienst: Wound reddened, dressing changed, Mobilized with assistance, Called staff multiple times during the night, No bowel movement for 2 days. Interventions: PRN medication given after consultation, Blood glucose monitored. Evaluation: Patient cooperative."
CASE-255,PAT-206205,Geriatrics,2026-02-17,Late shift,"Spätdienst: Called staff multiple times during the night, Reduced appetite, No acute pain reported, Patient awake and oriented, Bowel movement occurred. Interventions: Pressure ulcer prevention implemented, Positioning performed as scheduled. Evaluation: No complications during shift."
CASE-198,PAT-694538,Geriatrics,2026-02-12,Early shift,"Frühdienst: Fluid intake below 1 liter, Mild dyspnea on exertion, Pain score 5/10 in surgical area, Bowel movement occurred. Interventions: Positioning performed as scheduled, Mobilized to bedside, Fluid balance documented, Pressure ulcer prevention implemented. Evaluation: Therapy adjustment ordered by physician."
CASE-198,PAT-694538,Geriatrics,2026-02-13,Late shift,"Spätdienst: Bowel movement occurred, Pain score 5/10 in surgical area, Mobilized with assistance, Restful night sleep, Wound without irritation, dry. Interventions: PRN medication given after consultation, Mobilized to bedside, Pressure ulcer prevention implemented, Blood glucose monitored. Evaluation: Therapy adjustment ordered by physician."
CASE-198,PAT-694538,Geriatrics,2026-02-14,Night shift,"Nachtdienst: Intermittently disoriented to situation, Patient awake and oriented, Bowel movement occurred, Wound without irritation, dry, Wound reddened, dressing changed. Interventions: Pressure ulcer prevention implemented, Mobilized in corridor with walker. Evaluation: Therapy adjustment ordered by physician."
CASE-198,PAT-694538,Geriatrics,2026-02-15,Early shift,"Frühdienst: Mobilized with assistance, No acute pain reported, No bowel movement for 2 days, Fluid intake adequate, Patient awake and oriented. Interventions: PRN medication given after consultation, Family discussion conducted, Blood glucose monitored. Evaluation: Close monitoring still required."
